{
  "registry_id": "REGISTRY-BRAIN-RUNTIME-HARDENING",
  "status": "ACTIVE",
  "purpose": "Traceability for the runtime hardening pass that closed the repository review findings: operator authentication in front of the Observatory BFF, credential precedence in the Brain API, evidence deduplication and recomputed belief state, durable worker cognition, bounded tenant partitions, structured logging, and one canonical cockpit route surface.",
  "rules": [
    "Every finding fixed here is covered by an executable regression test, not only by review.",
    "Security-relevant defaults fail closed: absent configuration refuses requests rather than disabling the check.",
    "Derived state (belief evidence fingerprints) is reconstructed from durable rows and never becomes a second source of truth."
  ],
  "sources": [
    {
      "source_id": "SRC-RUNTIME-REVIEW-FINDINGS",
      "path": "docs/control/RUNTIME_HARDENING_REVIEW.md",
      "label": "SOURCE"
    }
  ],
  "requirements": [
    {
      "requirement_id": "REQ-BFF-OPERATOR-AUTHENTICATION",
      "source_ids": [
        "SRC-RUNTIME-REVIEW-FINDINGS"
      ],
      "label": "APPROVED"
    },
    {
      "requirement_id": "REQ-CREDENTIAL-PRECEDENCE",
      "source_ids": [
        "SRC-RUNTIME-REVIEW-FINDINGS"
      ],
      "label": "APPROVED"
    },
    {
      "requirement_id": "REQ-EVIDENCE-DEDUPLICATION",
      "source_ids": [
        "SRC-RUNTIME-REVIEW-FINDINGS"
      ],
      "label": "APPROVED"
    },
    {
      "requirement_id": "REQ-DURABLE-WORKER-COGNITION",
      "source_ids": [
        "SRC-RUNTIME-REVIEW-FINDINGS"
      ],
      "label": "APPROVED"
    },
    {
      "requirement_id": "REQ-BOUNDED-TENANT-PARTITIONS",
      "source_ids": [
        "SRC-RUNTIME-REVIEW-FINDINGS"
      ],
      "label": "APPROVED"
    },
    {
      "requirement_id": "REQ-DIAGNOSABLE-COGNITION-LOOP",
      "source_ids": [
        "SRC-RUNTIME-REVIEW-FINDINGS"
      ],
      "label": "APPROVED"
    },
    {
      "requirement_id": "REQ-CANONICAL-COCKPIT-ROUTE-SURFACE",
      "source_ids": [
        "SRC-RUNTIME-REVIEW-FINDINGS"
      ],
      "label": "APPROVED"
    }
  ],
  "code_module_records": [
    {
      "record_id": "TRACE-COCKPIT-READ-ROUTES",
      "paths": [
        "apps/api/cockpit_read_routes.py"
      ],
      "classification": "APPROVED",
      "go_hold_status": "REVIEW",
      "source_ids": [
        "SRC-RUNTIME-REVIEW-FINDINGS"
      ],
      "requirement_ids": [
        "REQ-CANONICAL-COCKPIT-ROUTE-SURFACE"
      ],
      "owner_object": "Brain cockpit read model",
      "schema": "list envelope {items, total, source} over signals, edges, contradictions, curiosity tasks and sources projected from durable Brain state",
      "runtime_service": "apps.api.main, registered on the canonical FastAPI app served by Dockerfile",
      "state_machine": "durable event stream and belief store -> per-route read projection -> authenticated JSON list envelope",
      "fixtures": [
        "tests/test_live_cockpit_signals.py",
        "tests/test_canonical_image_route_surface.py"
      ],
      "tests": [
        "pytest tests/test_canonical_image_route_surface.py",
        "pytest tests/test_live_cockpit_signals.py"
      ],
      "acceptance_criteria": [
        "the canonical Dockerfile image serves every collection route the Observatory client calls",
        "every cockpit read route requires authentication",
        "a client function added against a route the API never gained fails the suite",
        "GET /signals reads the durable signal.enqueued event stream, not the evidence projection"
      ],
      "audit_events": [
        "COCKPIT_READ_MODEL_SERVED"
      ],
      "source_preservation": "route bodies moved verbatim from tools/live_cockpit_routes.py; the Vercel OIDC bridge remains in that module",
      "unresolved_gaps": [
        "approvals, opportunities, outcomes, formula-runs and acceptance-reports answer with empty collections until the runtime populates them",
        "the Dockerfile.railway entrypoint remains the only image carrying VercelOidcAuthBridge"
      ]
    },
    {
      "record_id": "TRACE-RUNTIME-LOGGING",
      "paths": [
        "brain/logging_config.py"
      ],
      "classification": "APPROVED",
      "go_hold_status": "REVIEW",
      "source_ids": [
        "SRC-RUNTIME-REVIEW-FINDINGS"
      ],
      "requirement_ids": [
        "REQ-DIAGNOSABLE-COGNITION-LOOP"
      ],
      "owner_object": "Brain runtime observability",
      "schema": "one JSON object per line carrying ts, level, logger, message, promoted extra fields and any exception traceback",
      "runtime_service": "brain.logging_config, configured by every Brain entrypoint",
      "state_machine": "unconfigured -> configure_logging attaches exactly one stderr handler to the brain logger tree -> get_logger returns namespaced loggers",
      "fixtures": [
        "tests/test_worker_persistence.py"
      ],
      "tests": [
        "pytest tests/test_worker_persistence.py",
        "ruff check brain apps"
      ],
      "acceptance_criteria": [
        "configuration is idempotent and never attaches a duplicate handler",
        "no handler is attached to the root logger, so embedding an application is not hijacked",
        "the continuous cognition loop reports every swallowed failure instead of passing silently",
        "BRAIN_LOG_PROPAGATE forwards records to root when an aggregator needs them"
      ],
      "audit_events": [
        "COGNITION_STEP_FAILED"
      ],
      "source_preservation": "new module; no prior logging configuration existed in the repository",
      "unresolved_gaps": [
        "handlers that fall back to a computed default outside the cognition loop remain unlogged by design"
      ]
    }
  ]
}
